[
  {
    "id": "bear-gerhardt",
    "name_en": "Bear Gerhardt",
    "name_he": "בר גרהרדט",
    "seasons": [
      2
    ],
    "faction": "crime",
    "fate": "dead",
    "bio_en": "Bear Gerhardt is the middle son of the Fargo crime family in 1979. He is loyal to his mother Floyd and kills his niece Simone for betraying the family. At the Sioux Falls motel he tries to kill Lou Solverson. Lou shoots him dead.",
    "bio_he": "בר גרהרדט הוא הבן האמצעי של משפחת הפשע מפארגו ב-1979. הוא נאמן לאמו פלויד והורג את אחייניתו סימון על שבגדה במשפחה. במוטל בסו פולס הוא מנסה להרוג את לו סולוורסון. לו יורה בו והורג אותו.",
    "also_known_as": []
  },
  {
    "id": "ben-schmidt",
    "name_en": "Ben Schmidt",
    "name_he": "בן שמידט",
    "seasons": [
      1,
      2
    ],
    "faction": "law",
    "fate": "alive",
    "bio_en": "Ben Schmidt is a Fargo police detective in 1979 who works the Gerhardt case with Lou Solverson. By 2006 he is a senior lieutenant in Duluth and Gus Grimly's boss. He is still on the force at the end of his story.",
    "bio_he": "בן שמידט הוא בלש במשטרת פארגו ב-1979, וחוקר את פרשת גרהרדט עם לו סולוורסון. ב-2006 הוא סגן בכיר בדולות והמפקד של גאס גרימלי. בסוף הסיפור הוא עדיין במשטרה.",
    "also_known_as": []
  },
  {
    "id": "betsy-solverson",
    "name_en": "Betsy Solverson",
    "name_he": "בטסי סולוורסון",
    "seasons": [
      2
    ],
    "faction": "civilian",
    "fate": "dead",
    "bio_en": "Betsy Solverson is Lou's wife and Molly's mother. In 1979 she is fighting cancer in Luverne while the Gerhardt war unfolds. She survives that winter. The show makes clear she dies of the cancer before 2006.",
    "bio_he": "בטסי סולוורסון היא אשתו של לו ואמה של מולי. ב-1979 היא נלחמת בסרטן בלוורן בזמן מלחמת גרהרדט. היא שורדת את החורף ההוא. הסדרה מבהירה שהיא מתה מהסרטן לפני 2006.",
    "also_known_as": []
  },
  {
    "id": "bill-budge",
    "name_en": "Bill Budge",
    "name_he": "ביל באג'",
    "seasons": [
      1
    ],
    "faction": "law",
    "fate": "alive",
    "bio_en": "Bill Budge is an FBI agent paired with Webb Pepper. They watch the Fargo syndicate and miss Lorne Malvo's massacre. The Bureau demotes both men to filing clerks. They are alive at the end of the season.",
    "bio_he": "ביל באג' הוא סוכן אף־בי־איי שעובד עם וב פפר. הם עוקבים אחרי הארגון מפארגו ומפספסים את הטבח של לורן מאלוו. הלשכה מורידה את שניהם לארכיון. הם בחיים בסוף העונה.",
    "also_known_as": []
  },
  {
    "id": "bill-oswalt",
    "name_en": "Bill Oswalt",
    "name_he": "ביל אוסוולט",
    "seasons": [
      1
    ],
    "faction": "law",
    "fate": "alive",
    "bio_en": "Bill Oswalt becomes Bemidji police chief after Vern Thurman is murdered. He refuses Molly Solverson's theory and clears Lester Nygaard. He is a decent man and a bad investigator. He is alive when the case finally breaks.",
    "bio_he": "ביל אוסוולט מתמנה למפקד משטרת במיג'י אחרי רצח ורן תורמן. הוא דוחה את התיאוריה של מולי סולוורסון ומנקה את לסטר נייגארד. הוא אדם הגון וחוקר גרוע. הוא בחיים כשהתיק נפתח סוף סוף.",
    "also_known_as": []
  },
  {
    "id": "bo-munk",
    "name_en": "Bo Munk",
    "name_he": "בו מאנק",
    "seasons": [
      1
    ],
    "faction": "civilian",
    "fate": "alive",
    "bio_en": "Bo Munk runs the Bemidji insurance office where Lester Nygaard works. He is Lester's boss before and after the murders. The season does not harm him. He is alive at the end.",
    "bio_he": "בו מאנק מנהל את משרד הביטוח בבמיג'י שבו עובד לסטר נייגארד. הוא הבוס של לסטר לפני הרציחות ואחריהן. העונה לא פוגעת בו. הוא בחיים בסוף.",
    "also_known_as": []
  },
  {
    "id": "bowman",
    "name_en": "Bowman",
    "name_he": "באומן",
    "seasons": [
      5
    ],
    "faction": "crime",
    "fate": "dead",
    "bio_en": "Bowman is the foreman at Roy Tillman's ranch and Roy's right-hand man. He helps run the sheriff's private force. Ole Munch shoots him in the head during the fight at the ranch.",
    "bio_he": "באומן הוא מנהל העבודה בחווה של רוי טילמן ואיש אמונו. הוא עוזר לנהל את הכוח הפרטי של השריף. אולה מונך יורה לו בראש בקרב בחווה.",
    "also_known_as": []
  },
  {
    "id": "buel-cannon",
    "name_en": "Buel Cannon",
    "name_he": "ביואל קנון",
    "seasons": [
      4
    ],
    "faction": "civilian",
    "fate": "alive",
    "bio_en": "Buel Cannon is Loy Cannon's wife and the mother of Lemuel, Satchel, and their sisters. She keeps the family together while Loy fights the Faddas in 1950. She is alive when Satchel comes home and Loy is killed.",
    "bio_he": "ביואל קנון היא אשתו של לוי קנון ואמם של למואל, סאצ'ל ואחיותיהם. היא מחזיקה את המשפחה בזמן שלוי נלחם בפאדה ב-1950. היא בחיים כשסאצ'ל חוזר הביתה ולוי נהרג.",
    "also_known_as": []
  },
  {
    "id": "burt-canton",
    "name_en": "Burt Canton",
    "name_he": "ברט קנטון",
    "seasons": [
      1
    ],
    "faction": "civilian",
    "fate": "alive",
    "bio_en": "Burt Canton is a Kansas City dentist. In 2007 Lorne Malvo, posing as a fellow dentist, befriends him to reach Burt's brother in witness protection. Lester Nygaard exposes Malvo before that hit. Burt survives.",
    "bio_he": "ברט קנטון הוא רופא שיניים בקנזס סיטי. ב-2007 לורן מאלוו, שמתחזה לרופא שיניים, מתקרב אליו כדי להגיע לאחיו שנמצא בהגנת עדים. לסטר נייגארד חושף את מאלוו לפני החיסול. ברט שורד.",
    "also_known_as": []
  },
  {
    "id": "carl-showalter",
    "name_en": "Carl Showalter",
    "name_he": "קרל שוואלטר",
    "seasons": [
      0
    ],
    "faction": "crime",
    "fate": "dead",
    "bio_en": "Carl Showalter is the talkative kidnapper Jerry Lundegaard hires in 1987. He and Gaear Grimsrud take Jean Lundegaard. Carl shoots Wade Gustafson, buries most of the ransom, and fights Gaear over the car. Gaear kills him with an axe.",
    "bio_he": "קרל שוואלטר הוא החוטף הדברן שג'רי לונדגורד שוכר ב-1987. הוא וגאיר גרימסרוד חוטפים את ג'ין לונדגורד. קרל יורה בווייד גוסטפסון, קובר את רוב הכופר, ורב עם גאיר על המכונית. גאיר הורג אותו בגרזן.",
    "also_known_as": []
  },
  {
    "id": "charlie-gerhardt",
    "name_en": "Charlie Gerhardt",
    "name_he": "צ'רלי גרהרדט",
    "seasons": [
      2
    ],
    "faction": "crime",
    "fate": "alive",
    "bio_en": "Charlie Gerhardt is Bear's teenage son. Dodd sends him with Virgil Bauer to kill Ed Blumquist. The hit fails, Virgil dies, and Charlie is badly hurt and hospitalized. He is not among the Gerhardts killed later.",
    "bio_he": "צ'רלי גרהרדט הוא בנו המתבגר של בר. דוד שולח אותו עם וירג'יל באואר להרוג את אד בלומקוויסט. החיסול נכשל, וירג'יל מת, וצ'רלי נפצע קשה ומאושפז. הוא לא בין בני גרהרדט שנהרגים אחר כך.",
    "also_known_as": []
  },
  {
    "id": "chazz-nygaard",
    "name_en": "Chazz Nygaard",
    "name_he": "צ'אז נייגארד",
    "seasons": [
      1
    ],
    "faction": "civilian",
    "fate": "alive",
    "bio_en": "Chazz Nygaard is Lester's richer younger brother. After the murders, Lester hides the weapon and other proof in Chazz's gun safe and sends the police to him. Chazz is jailed for crimes he did not commit. He is alive in prison.",
    "bio_he": "צ'אז נייגארד הוא אחיו הצעיר והעשיר של לסטר. אחרי הרציחות לסטר מחביא את הנשק ושאר הראיות בכספת של צ'אז ומפנה אליו את המשטרה. צ'אז נכלא על פשעים שלא ביצע. הוא בחיים בכלא.",
    "also_known_as": []
  },
  {
    "id": "chianna-fadda",
    "name_en": "Chianna Fadda",
    "name_he": "קיאנה פאדה",
    "seasons": [
      4
    ],
    "faction": "civilian",
    "fate": "dead",
    "bio_en": "Chianna Fadda is the mother of Josto and Gaetano. During the Kansas City war, gunmen hit the family house. She is struck by the bullets and dies inside while her sons fight back.",
    "bio_he": "קיאנה פאדה היא אמם של ג'וסטו וגאטאנו. במלחמה בקנזס סיטי יורים פוגעים בבית המשפחה. היא נפגעת מהכדורים ומתה בפנים בזמן שבניה משיבים אש.",
    "also_known_as": []
  },
  {
    "id": "chief-gibson",
    "name_en": "Chief Gibson",
    "name_he": "המפקד גיבסון",
    "seasons": [
      2
    ],
    "faction": "law",
    "fate": "dead",
    "bio_en": "Chief Gibson leads officers of the South Dakota Highway Patrol at the Sioux Falls motel. He is on the scene when the Gerhardts and Hanzee Dent arrive. Hanzee shoots him dead in the massacre.",
    "bio_he": "המפקד גיבסון מוביל שוטרים של משטרת הכבישים של דרום דקוטה במוטל בסו פולס. הוא במקום כשבני גרהרדט והנזי דנט מגיעים. הנזי יורה בו והורג אותו בטבח.",
    "also_known_as": []
  },
  {
    "id": "constant-calamita",
    "name_en": "Constant Calamita",
    "name_he": "קונסטנט קלאמיטה",
    "seasons": [
      4
    ],
    "faction": "crime",
    "fate": "dead",
    "bio_en": "Constant Calamita is a Fadda hitman who sides with Gaetano against Josto. He shoots Doctor Senator in the street. Later he corners Rabbi Milligan and Satchel. A tornado kills him, Rabbi, and Omie Sparkman.",
    "bio_he": "קונסטנט קלאמיטה הוא רוצח שכיר של פאדה שעומד עם גאטאנו נגד ג'וסטו. הוא יורה בדוקטור סנטור ברחוב. אחר כך הוא לוכד את רבי מיליגן ואת סאצ'ל. טורנדו הורג אותו, את רבי ואת אומי ספארקמן.",
    "also_known_as": []
  },
  {
    "id": "danish-graves",
    "name_en": "Danish Graves",
    "name_he": "דניש גרייבס",
    "seasons": [
      5
    ],
    "faction": "civilian",
    "fate": "dead",
    "bio_en": "Danish Graves is Lorraine Lyon's lawyer and fixer. He shields the family and offers Roy Tillman an election deal in exchange for Dot. Roy answers by shooting Danish in the chest and the head.",
    "bio_he": "דניש גרייבס הוא עורך הדין והמתקן של לוריין ליון. הוא מגן על המשפחה ומציע לרוי טילמן עסקת בחירות תמורת דוט. רוי עונה בירי בחזה ובראש של דניש.",
    "also_known_as": []
  },
  {
    "id": "david-harvard",
    "name_en": "David Harvard",
    "name_he": "דייוויד הרוורד",
    "seasons": [
      4
    ],
    "faction": "civilian",
    "fate": "dead",
    "bio_en": "Dr. David Harvard runs a private Kansas City hospital and refuses to treat Donatello Fadda. Oraetta Mayflower later works at his hospital. Josto ambushes him, shoots him, and burns the body.",